{
    "$schema": "http://json-schema.org/draft-07/schema#",
    "$id": "",
    "title":"",
    "description":"",
    "type": "object",
    "properties": {
        "firstName": {
			"description": "Users first name",
            "type": "string",
            "minLength":1,
			"maxLength":20
            },
		"lastName": {
			"description": "Users last name",
            "type": "string",
            "minLength":1,
			"maxLength":20
            },
		"role": {
			"description": "Users role",
            "type": "string",
            "minLength":1,
			"maxLength":10
            },
		"email": {
			"description": "Users email",
            "type": "string",
            "minLength":1,
			"maxLength":30
            },
		"password": {
			"description": "Users password",
            "type": "string",
            "minLength":1,
			"maxLength":20
            }
		
       }
}